Feature Designation Code,Feature Designation Name,Feature Designation Text,Feature Class
LDNG,landing,"a place where boats receive or discharge passengers and freight, but lacking most port facilities",S
LEPC,leper colony,a settled area inhabited by lepers in relative isolation,S
LEV,levee,a natural low embankment bordering a distributary or meandering stream; often built up artificially to control floods,T
LEVU,undersea levee,"an embankment bordering a canyon, valley, or seachannel",U
LGN,lagoon,"a shallow coastal waterbody, completely or partly separated from a larger body of water by a barrier island, coral reef or other depositional feature",H
LGNS,lagoons,"shallow coastal waterbodies, completely or partly separated from a larger body of water by a barrier island, coral reef or other depositional feature",H
LGNX,section of lagoon,,H
LIBR,library,"A place in which information resources such as books are kept for reading, reference, or lending.",S
LK,lake,a large inland body of standing water,H
LKC,crater lake,a lake in a crater or caldera,H
LKI,intermittent lake,,H
LKN,salt lake,an inland body of salt water with no outlet,H
LKNI,intermittent salt lake,,H
LKO,oxbow lake,a crescent-shaped lake commonly found adjacent to meandering streams,H
LKOI,intermittent oxbow lake,,H
LKS,lakes,large inland bodies of standing water,H
LKSB,underground lake,a standing body of water in a cave,H
LKSC,crater lakes,lakes in a crater or caldera,H
LKSI,intermittent lakes,,H
LKSN,salt lakes,inland bodies of salt water with no outlet,H
LKSNI,intermittent salt lakes,,H
LKX,section of lake,,H
LNDF,landfill,a place for trash and garbage disposal in which the waste is buried between layers of earth to build up low-lying land,S
LOCK,lock(s),a basin in a waterway with gates at each end by means of which vessels are passed from one water level to another,S
LTER,leased area,a tract of land leased by the United Kingdom from the People's Republic of China to form part of Hong Kong,A
LTHSE,lighthouse,a distinctive structure exhibiting a major navigation light,S
MALL,mall,"A large, often enclosed shopping complex containing various stores, businesses, and restaurants usually accessible by common passageways.",S
MAR,marina,"a harbor facility for small boats, yachts, etc.",S
MDVU,undersea median valley,the axial depression of the mid-oceanic ridge system,U
MDW,meadow,"a small, poorly drained area dominated by grassy vegetation",V
MESA,mesa(s),"a flat-topped, isolated elevation with steep slopes on all sides, less extensive than a plateau",T
MESU,undersea mesa,"an isolated, extensive, flat-topped elevation on the shelf, with relatively steep sides",U
MFG,factory,"one or more buildings where goods are manufactured, processed or fabricated",S
MFGB,brewery,one or more buildings where beer is brewed,S
MFGC,cannery,a building where food items are canned,S
MFGCU,copper works,a facility for processing copper ore,S
MFGLM,limekiln,a furnace in which limestone is reduced to lime,S
MFGM,munitions plant,a factory where ammunition is made,S
MFGN,salt evaporation ponds,diked salt ponds used in the production of solar evaporated salt,H
MFGPH,phosphate works,a facility for producing fertilizer,S
MFGQ,abandoned factory,,S
MFGSG,sugar refinery,a facility for converting raw sugar into refined sugar,S
MGV,mangrove swamp,a tropical tidal mud flat characterized by mangrove vegetation,H
MILB,military base,"a place used by an army or other armed service for storing arms and supplies, and for accommodating and training troops, a base from which operations can be initiated",L
MKT,market,a place where goods are bought and sold at regular intervals,S
ML,mill(s),"a building housing machines for transforming, shaping, finishing, grinding, or extracting products",S
MLM,ore treatment plant,a facility for improving the metal content of ore by concentration,S
MLO,olive oil mill,a mill where oil is extracted from olives,S
MLSG,sugar mill,a facility where sugar cane is processed into raw sugar,S
MLSGQ,former sugar mill,a sugar mill no longer used as a sugar mill,S
MLSW,sawmill,a mill where logs or lumber are sawn to specified shapes and sizes,S
MLWND,windmill,a mill or water pump powered by wind,S
MLWTR,water mill,a mill powered by running water,S
MN,mine(s),a site where mineral ores are extracted from the ground by excavating surface pits and subterranean passages,S
MNA,mining area,an area of mine sites where minerals and ores are extracted,L
MNAU,gold mine(s),"a mine where gold ore, or alluvial gold is extracted",S
MNC,coal mine(s),a mine where coal is extracted,S
MNCR,chrome mine(s),a mine where chrome ore is extracted,S
MNCU,copper mine(s),a mine where copper ore is extracted,S
MND,mound(s),"a low, isolated, rounded hill",T
MNDT,diatomite mine(s),a place where diatomaceous earth is extracted,S
MNDU,undersea mound,"a low, isolated, rounded hill",U
MNFE,iron mine(s),a mine where iron ore is extracted,S
MNMT,monument,a commemorative structure or statue,S
MNN,salt mine(s),a mine from which salt is extracted,S
MNNI,nickel mine(s),a mine where nickel ore is extracted,S
MNPB,lead mine(s),a mine where lead ore is extracted,S
MNPL,placer mine(s),a place where heavy metals are concentrated and running water is used to extract them from unconsolidated sediments,S
MNQ,abandoned mine,,S
MNQR,quarry(-ies),"a surface mine where building stone or gravel and sand, etc. are extracted",S
MNSN,tin mine(s),a mine where tin ore is extracted,S
MOLE,mole,a massive structure of masonry or large stones serving as a pier or breakwater,S
MOOR,moor(s),an area of open ground overlaid with wet peaty soils,H
MOTU,undersea moat,"an annular depression that may not be continuous, located at the base of many seamounts, islands, and other isolated elevations",U
MRN,moraine,"a mound, ridge, or other accumulation of glacial till",T
MRSH,marsh(es),a wetland dominated by grass-like vegetation,H
MRSHN,salt marsh,"a flat area, subject to periodic salt water inundation, dominated by grassy salt-tolerant plants",H
MSQE,mosque,a building for public Islamic worship,S
MSSN,mission,"a place characterized by dwellings, school, church, hospital and other facilities operated by a religious group for the purpose of providing charitable services and to propagate religion",S
MSSNQ,abandoned mission,,S
MSTY,monastery,a building and grounds where a community of monks lives in seclusion,S
MT,mountain,"an elevation standing high above the surrounding area with small summit area, steep slopes and local relief of 300m or more",T
MTRO,metro station,"metro station (Underground, Tube, or M?tro) ",S
MTS,mountains,a mountain range or a group of mountains or high ridges,T
MTSU,undersea mountains,well-delineated subdivisions of a large and complex positive feature,U
MTU,undersea mountain,a well-delineated subdivision of a large and complex positive feature,U
MUS,museum,a building where objects of permanent interest in one or more of the arts and sciences are preserved and exhibited,S
MVA,maneuver area,a tract of land where military field exercises are carried out,L
NKM,meander neck,a narrow strip of land between the two limbs of a meander loop at its narrowest point,T
NOV,novitiate,a religious house or school where novices are trained,S
NRWS,narrows,"a navigable narrow part of a bay, strait, river, etc.",H
NSY,nursery(-ies),a place where plants are propagated for transplanting or grafting,S
NTK,nunatak,a rock or mountain peak protruding through glacial ice,T
NTKS,nunataks,rocks or mountain peaks protruding through glacial ice,T
NULL,not available,,NULL
NVB,naval base,"an area used to store supplies, provide barracks for troops and naval personnel, a port for naval vessels, and from which operations are initiated",L
OAS,oasis(-es),an area in a desert made productive by the availability of water,L
OBPT,observation point,a wildlife or scenic observation point,S
OBS,observatory,a facility equipped for observation of atmospheric or space phenomena,S
OBSR,radio observatory,a facility equipped with an array of antennae for receiving radio waves from space,S
OCH,orchard(s),a planting of fruit or nut trees,V
OCN,ocean,one of the major divisions of the vast expanse of salt water covering part of the earth,H
OILF,oilfield,an area containing a subterranean store of petroleum of economic value,L
OILJ,oil pipeline junction,a section of an oil pipeline where two or more pipes join together,S
OILP,oil pipeline,a pipeline used for transporting oil,R
OILQ,abandoned oil well,,S
OILR,oil refinery,a facility for converting crude oil into refined petroleum products,S
OILT,tank farm,"a tract of land occupied by large, cylindrical, metal tanks in which oil or liquid petrochemicals are stored",S
OILW,oil well,a well from which oil may be pumped,S
OPRA,opera house,A theater designed chiefly for the performance of operas.,S
OVF,overfalls,an area of breaking waves caused by the meeting of currents or by waves moving against the current,H
PAL,palace,"a large stately house, often a royal or presidential residence",S
PAN,pan,"a near-level shallow, natural depression or basin, usually containing an intermittent lake, pond, or pool",T
PANS,pans,"a near-level shallow, natural depression or basin, usually containing an intermittent lake, pond, or pool",T
PASS,pass,"a break in a mountain range or other high obstruction, used for transportation from one side to the other [See also gap]",T
PCL,political entity,,A
PCLD,dependent political entity,,A
PCLF,freely associated state,,A
PCLH,historical political entity,a former political entity,A
PCLI,independent political entity,,A
PCLIX,section of independent political entity,,A
PCLS,semi-independent political entity,,A
PEAT,peat cutting area,an area where peat is harvested,L
PEN,peninsula,an elongate area of land projecting into a body of water and nearly surrounded by water,T
PENX,section of peninsula,,T
PGDA,pagoda,"a tower-like storied structure, usually a Buddhist shrine",S
PIER,pier,a structure built out into navigable water on piles providing berthing for ships and recreation,S
PK,peak,"a pointed elevation atop a mountain, ridge, or other hypsographic feature",T
PKLT,parking lot,an area used for parking vehicles,S
PKS,peaks,"pointed elevations atop a mountain, ridge, or other hypsographic features",T
PKSU,undersea peaks,"prominent elevations, part of a larger feature, either pointed or of very limited extent across the summit",U
PKU,undersea peak,"a prominent elevation, part of a larger feature, either pointed or of very limited extent across the summit",U
PLAT,plateau,"an elevated plain with steep slopes on one or more sides, and often with incised streams",T
PLATX,section of plateau,,T
PLDR,polder,an area reclaimed from the sea by diking and draining,T
PLFU,undersea platform,a flat or gently sloping underwater surface extending seaward from the shore,U
PLN,plain(s),"an extensive area of comparatively level to gently undulating land, lacking surface irregularities, and usually adjacent to a higher area",T
PLNU,undersea plain,"a flat, gently sloping or nearly level region",U
PLNX,section of plain,,T
PLTU,undersea plateau,"a comparatively flat-topped feature of considerable extent, dropping off abruptly on one or more sides",U
PMPO,oil pumping station,a facility for pumping oil through a pipeline,S
PMPW,water pumping station,a facility for pumping water from a major well or through a pipeline,S
PND,pond,a small standing waterbody,H
PNDI,intermittent pond,,H
PNDN,salt pond,"a small standing body of salt water often in a marsh or swamp, usually along a seacoast",H
PNDNI,intermittent salt pond(s),,H
PNDS,ponds,small standing waterbodies,H
PNDSF,fishponds,ponds or enclosures in which fish are kept or raised,H
PNDSI,intermittent ponds,,H
PNDSN,salt ponds,"small standing bodies of salt water often in a marsh or swamp, usually along a seacoast",H
PNLU,undersea pinnacle,"a high tower or spire-shaped pillar of rock or coral, alone or cresting a summit",U
PO,post office,"a public building in which mail is received, sorted and distributed",S
POOL,pool(s),"a small and comparatively still, deep part of a larger body of water such as a stream or harbor; or a small body of standing water",H
POOLI,intermittent pool,,H
PP,police post,a building in which police are stationed,S
#PPL,populated place,"a city, town, village, or other agglomeration of buildings where people live and work",P
PPL,place,"a city, town, village, or other agglomeration of buildings where people live and work",P
#PPLA,seat of a first-order administrative division,seat of a first-order administrative division (PPLC takes precedence over PPLA),P
PPLA,seat of primary division,seat of a first-order administrative division (PPLC takes precedence over PPLA),P
#PPLA2,seat of a second-order administrative division,,P
PPLA2,seat of secondary division,,P
PPLA3,seat of a third-order administrative division,,P
PPLA4,seat of a fourth-order administrative division,,P
#PPLC,capital of a political entity,,P
PPLC,capital,,P
PPLCH,historical capital of a political entity,a former capital of a political entity,P
PPLF,farm village,a populated place where the population is largely engaged in agricultural activities,P
#PPLG,seat of government of a political entity,,P
PPLG,seat of government,,P
PPLH,historical populated place,a populated place that no longer exists,P
PPLL,populated locality,an area similar to a locality but with a small group of dwellings or other buildings,P
PPLQ,abandoned populated place,,P
PPLR,religious populated place,a populated place whose population is largely engaged in religious occupations,P
PPLS,populated places,"cities, towns, villages, or other agglomerations of buildings where people live and work",P
PPLW,destroyed populated place,"a village, town or city destroyed by a natural disaster, or by war",P
PPLX,section of populated place,,P
PPQ,abandoned police post,,S
PRK,park,"an area, often of forested land, maintained as a place of beauty, or for recreation",L
PRKGT,park gate,a controlled access to a park,S
PRKHQ,park headquarters,a park administrative facility,S
PRMN,promenade,"a place for public walking, usually along a beach front",R
PRN,prison,a facility for confining prisoners,S
PRNJ,reformatory,"a facility for confining, training, and reforming young law offenders",S
PRNQ,abandoned prison,,S
PROM,promontory(-ies),a bluff or prominent hill overlooking or projecting into a lowland,T
PRSH,parish,an ecclesiastical district,A
PRT,port,"a place provided with terminal and transfer facilities for loading and discharging waterborne cargo or passengers, usually located in a harbor",L
PRVU,undersea province,a region identifiable by a group of similar physiographic features whose characteristics are markedly in contrast with surrounding areas,U
PS,power station,a facility for generating electric power,S
PSH,hydroelectric power station,a building where electricity is generated from water power,S
PSN,nuclear power station,,S
PSTB,border post,a post or station at an international boundary for the regulation of movement of people and goods,S
PSTC,customs post,a building at an international boundary where customs and duties are paid on goods,S
PSTP,patrol post,a post from which patrols are sent out,S
PT,point,"a tapering piece of land projecting into a body of water, less prominent than a cape",T
PTGE,portage,"a place where boats, goods, etc., are carried overland between navigable waters",R
PTS,points,"tapering pieces of land projecting into a body of water, less prominent than a cape",T
PYR,pyramid,an ancient massive structure of square ground plan with four triangular faces meeting at a point and used for enclosing tombs,S
PYRS,pyramids,ancient massive structures of square ground plan with four triangular faces meeting at a point and used for enclosing tombs,S
QCKS,quicksand,"an area where loose sand with water moving through it may become unstable when heavy objects are placed at the surface, causing them to sink",L
QUAY,quay,a structure of solid construction along a shore or bank which provides berthing for ships and which generally provides cargo handling facilities,S
RAVU,undersea ravine,a small canyon,U
RCH,reach,a straight section of a navigable stream or channel between two bends,H
RD,road,"an open way with improved surface for transportation of animals, people and vehicles",R
RDA,ancient road,the remains of a road used by ancient cultures,R
RDB,road bend,a conspicuously curved or bent section of a road,R
RDCR,traffic circle,a road junction formed around a central circle about which traffic moves in one direction only,S
RDCUT,road cut,an excavation cut through a hill or ridge for a road,R
RDGB,beach ridge,"a ridge of sand just inland and parallel to the beach, usually in series",T
RDGE,ridge(s),"a long narrow elevation with steep sides, and a more or less continuous crest",T
RDGG,icecap ridge,a linear elevation on an icecap,H
RDGU,undersea ridge,a long narrow elevation with steep sides,U
RDIN,intersection,a junction of two or more highways by a system of separate levels that permit traffic to pass from one to another without the crossing of traffic streams,S
RDJCT,road junction,a place where two or more roads join,R
RDST,roadstead,an open anchorage affording less protection than a harbor,H
RDSU,undersea ridges,long narrow elevations with steep sides,U
RECG,golf course,a recreation field where golf is played,S
RECR,racetrack,a track where races are held,S
REG,stony desert,a desert plain characterized by a surface veneer of gravel and stones,T
REP,republic,,L
RES,reserve,a tract of public land reserved for future use or restricted as to use,L
RESA,agricultural reserve,a tract of land reserved for agricultural reclamation and/or development,L
RESF,forest reserve,a forested area set aside for preservation or controlled use,L
RESH,hunting reserve,a tract of land used primarily for hunting,L
RESN,nature reserve,an area reserved for the maintenance of a natural habitat,L
RESP,palm tree reserve,an area of palm trees where use is controlled,L
REST,restaurant,A place where meals are served to the public,S
RESV,reservation,"a tract of land set aside for aboriginal, tribal, or native populations",L
RESW,wildlife reserve,a tract of public land reserved for the preservation of wildlife,L
RET,store,a building where goods and/or services are offered for sale,S
RF,reef(s),a surface-navigation hazard composed of consolidated material,H
RFC,coral reef(s),a surface-navigation hazard composed of coral,H
RFSU,undersea reefs,surface-navigation hazards composed of consolidated material,U
RFU,undersea reef,a surface-navigation hazard composed of consolidated material,U
RFX,section of reef,,H
RGN,region,an area distinguished by one or more observable physical or cultural characteristics,L
RGNE,economic region,a region of a country established for economic development or for statistical purposes,L
RGNH,historical region,a former area distinguished by one or more observable physical or cultural characteristics,L
RGNL,lake region,a tract of land distinguished by numerous lakes,L
RHSE,resthouse,a structure maintained for the rest and shelter of travelers,S
RISU,undersea rise,"a broad elevation that rises gently, and generally smoothly, from the sea floor",U
RJCT,railroad junction,a place where two or more railroad tracks join,R
RK,rock,"a conspicuous, isolated rocky mass",T
RKFL,rockfall,an irregular mass of fallen rock at the base of a cliff or steep slope,T
RKRY,rookery,a breeding place of a colony of birds or seals,S
RKS,rocks,"conspicuous, isolated rocky masses",T
RLG,religious site,an ancient site of significant religious importance,S
RLGR,retreat,"a place of temporary seclusion, especially for religious groups",S
RMPU,undersea ramp,a gentle slope connecting areas of different elevations,U
RNCH,ranch(es),a large farm specializing in extensive grazing of livestock,S
RNGA,artillery range,a tract of land used for artillery firing practice,L
RNGU,undersea range,a series of associated ridges or seamounts,U
RPDS,rapids,"a turbulent section of a stream associated with a steep, irregular stream bed",H
RR,railroad,a permanent twin steel-rail track on which freight and passenger cars move long distances,R
RRQ,abandoned railroad,,R
RSD,railroad siding,a short track parallel to and joining the main track,S
RSGNL,railroad signal,a signal at the entrance of a particular section of track governing the movement of trains,S
RSRT,resort,"a specialized facility for vacation, health, or participation sports activities",S
RSTN,railroad station,"a facility comprising ticket office, platforms, etc. for loading and unloading train passengers and freight",S
RSTNQ,abandoned railroad station,,S
RSTP,railroad stop,a place lacking station facilities where trains stop to pick up and unload passengers and freight,S
RSTPQ,abandoned railroad stop,,S
RSV,reservoir(s),an artificial pond or lake,H
RSVI,intermittent reservoir,,H
RSVT,water tank,"a contained pool or tank of water at, below, or above ground level",H
RTE,caravan route,the route taken by caravans,R
RUIN,ruin(s),a destroyed or decayed structure which is no longer functional,S
RVN,ravine(s),"a small, narrow, deep, steep-sided stream channel, smaller than a gorge",H
RYD,railroad yard,"a system of tracks used for the making up of trains, and switching and storing freight cars",R
SALT,salt area,a shallow basin or flat where salt accumulates after periodic inundation,L
SAND,sand area,a tract of land covered with sand,T
SBED,dry stream bed,a channel formerly containing the water of a stream,T
SBKH,sabkha(s),a salt flat or salt encrusted plain subject to periodic inundation from flooding or high tides,H
SCH,school,building(s) where instruction in one or more branches of knowledge takes place,S
SCHA,agricultural school,a school with a curriculum focused on agriculture,S
SCHC,college,the grounds and buildings of an institution of higher learning,S
SCHL,language school,Language Schools & Institutions,S
SCHM,military school,a school at which military science forms the core of the curriculum,S
SCHN,maritime school,a school at which maritime sciences form the core of the curriculum,S
SCHT,technical school,post-secondary school with a specifically technical or vocational curriculum,S
SCNU,seachannel,"a continuously sloping, elongated depression commonly found in fans or plains and customarily bordered by levees on one or two sides",U
SCRB,scrubland,"an area of low trees, bushes, and shrubs stunted by some environmental limitation",V
SCRP,escarpment,a long line of cliffs or steep slopes separating level surfaces above and below,T
SCSU,seachannels,"continuously sloping, elongated depressions commonly found in fans or plains and customarily bordered by levees on one or two sides",U
SD,sound,a long arm of the sea forming a channel between the mainland and an island or islands; or connecting two larger bodies of water,H
SDL,saddle,"a broad, open pass crossing a ridge or between hills or mountains",T
SDLU,undersea saddle,"a low part, resembling in shape a saddle, in a ridge or between contiguous seamounts",U
SEA,sea,a large body of salt water more or less confined by continuous land or chains of islands forming a subdivision of an ocean,H
SECP,State Exam Prep Centre,state exam preparation centres,S
SHFU,undersea shelf,a zone adjacent to a continent (or around an island) that extends from the low water line to a depth at which there is usually a marked increase of slope towards oceanic depths,U
SHLU,undersea shoal,a surface-navigation hazard composed of unconsolidated material,U
SHOL,shoal(s),a surface-navigation hazard composed of unconsolidated material,H
SHOPC,shopping center or mall,an urban shopping area featuring a variety of shops surrounding a usually open-air concourse reserved for pedestrian traffic; or a large suburban building or group of buildings containing various shops with associated passageways,S
SHOR,shore,"a narrow zone bordering a waterbody which covers and uncovers at high and low water, respectively",T
SHPF,sheepfold,a fence or wall enclosure for sheep and other small herd animals,S
SHRN,shrine,a structure or place memorializing a person or religious concept,S
SHSE,storehouse,"a building for storing goods, especially provisions",S
SHSU,undersea shoals,hazards to surface navigation composed of unconsolidated material,U
SHVU,undersea shelf valley,"a valley on the shelf, generally the shoreward extension of a canyon",U
SILL,sill,"the low part of an underwater gap or saddle separating basins, including a similar feature at the mouth of a fjord",H
SILU,undersea sill,the low part of a gap or saddle separating basins,U
SINK,sinkhole,a small crater-shape depression in a karst area,T
SLCE,sluice,"a conduit or passage for carrying off surplus water from a waterbody, usually regulated by means of a sluice gate",S
SLID,slide,"a mound of earth material, at the base of a slope and the associated scoured area",T
SLP,slope(s),a surface with a relatively uniform slope angle,T
SLPU,undersea slope,the slope seaward from the shelf edge to the beginning of a continental rise or the point where there is a general reduction in slope,U
SMSU,seamounts,"elevations rising generally more than 1,000 meters and of limited extent across the summit",U
SMU,seamount,"an elevation rising generally more than 1,000 meters and of limited extent across the summit",U
SNOW,snowfield,an area of permanent snow and ice forming the accumulation area of a glacier,L
SNTR,sanatorium,a facility where victims of physical or mental disorders are treated,S
SPA,spa,a resort area usually developed around a medicinal spring,S
