Feature_Designation_Code,Feature_Designation_Name,Feature_Designation_Description,Collection_Guidance,Feature_Class
TNGU,undersea tongue,an elongate (tongue-like) extension of a flat sea floor into an adjacent higher feature,Center of Feature (modification/addition requires ACUF approval),U - Undersea
TNKD,cattle dipping tank,a small artificial pond used for immersing cattle in chemically treated water for disease control,Center of Feature,S - Spot Features
TNL,tunnel(s),"naturally occurring or manmade underground passage(s), open at both ends and usually containing a transportation route",Center of Feature,R - Transportation Networks
TNLC,canal tunnel,a tunnel through which a canal passes,Center of Feature,H - Hydrographic
TNLRD,road tunnel,a tunnel through which a road passes,Center of Feature,R - Transportation Networks
TNLRR,railroad tunnel,a tunnel through which a railroad passes,Center of Feature,R - Transportation Networks
TOLL,toll gate/barrier,highway toll collection station,Center of Feature,S - Spot Features
TOWR,tower,"a high conspicuous structure, typically much higher than its diameter",Center of Feature,S - Spot Features
TRANT,transit terminal,facilities for the handling of vehicular freight and passengers,Center of Feature,S - Spot Features
TRB,tribal area,a tract of land used by nomadic or other tribes,Center of Feature,L - Areas/Localities
TREE,tree(s),conspicuous tree(s) used as landmark(s),Center of Feature,V - Vegetation
TRGD,interdune trough(s),long wind-swept trough(s) between parallel longitudinal dunes,Center of Feature,T - Hypsographic
TRGU,undersea trough,"a long depression of the sea floor characteristically flat bottomed and steep sided, and normally shallower than a trench",Center of Feature (modification/addition requires ACUF approval),U - Undersea
TRIG,triangulation station,a point on the earth whose position has been determined by triangulation,Center of Feature,S - Spot Features
TRL,trail,"a path, track, or route used by pedestrians, animals, or off-road vehicles","Westernmost End (When feature is North to South Oriented, Southernmost End)",R - Transportation Networks
TRMO,oil pipeline terminal,a tank farm or loading facility at the end of an oil pipeline,Center of Feature,S - Spot Features
TRNU,undersea trench,"a long, narrow, characteristically very deep and asymmetrical depression of the sea floor, with relatively steep sides",Center of Feature (modification/addition requires ACUF approval),U - Undersea
TRR,terrace,"a long, narrow alluvial platform bounded by steeper slopes above and below, usually overlooking a waterbody",Center of Feature,T - Hypsographic
TUND,tundra,"a marshy, treeless, high latitude plain, dominated by mosses, lichens, and low shrub vegetation under permafrost conditions",Center of Feature,V - Vegetation
UPLD,upland,an extensive interior region of high land with low to moderate surface relief,Center of Feature,T - Hypsographic
VAL,valley(s),elongated depression(s) usually traversed by a stream,Center of Feature,T - Hypsographic
VALG,hanging valley,a valley the floor of which is notably higher than the valley or shore to which it leads; most common in areas that have been glaciated,Center of Feature,T - Hypsographic
VALU,undersea valley,"a relatively shallow, wide depression, the bottom of which usually has a continuous gradient",Center of Feature (modification/addition requires ACUF approval),U - Undersea
VALX,section of valley,section of valley,Center of Feature,T - Hypsographic
VETF,veterinary facility,a building or camp at which veterinary services are available,Center of Feature,S - Spot Features
VIN,vineyard(s),planting(s) of grapevines,Center of Feature,V - Vegetation
VLC,volcano,a conical elevation composed of volcanic materials with a crater at the top,Center of Feature,T - Hypsographic
VLSU,undersea valleys,"a relatively shallow, wide depression, the bottom of which usually has a continuous gradient",Center of Feature (modification/addition requires ACUF approval),U - Undersea
WAD,wadi(s),"dry, intermittent, or ephemeral drainage course(s) commonly found in North Africa, and the Middle East, the channels of which are commonly shallow and braided",At Mouth,H - Hydrographic
WADB,wadi bend,a conspicuously curved or bent segment of a wadi,Center of Feature,H - Hydrographic
WADJ,wadi junction,a place where two or more wadies join,Center of Feature,H - Hydrographic
WADM,wadi mouth,"the lower terminus of a wadi where it widens into an adjoining floodplain, depression, or waterbody",Center of Feature,H - Hydrographic
WADX,section of wadi,section of wadi,Center of Feature,H - Hydrographic
WALL,wall,"a thick masonry structure, usually enclosing a field or building, or forming the side of a structure",Center of Feature,S - Spot Features
WALLA,ancient wall,the remains of a linear defensive stone structure,Center of Feature,S - Spot Features
WEIR,weir(s),"small dam(s) in a stream, designed to raise the water level or to divert stream flow through a desired channel",Center of Feature,S - Spot Features
WHRF,wharf(-ves),a structure of open rather than solid construction along a shore or a bank which provides berthing for ships and cargo-handling facilities,Center of Feature,S - Spot Features
WHRL,whirlpool,"a turbulent, rotating movement of water in a stream",Center of Feature,H - Hydrographic
WLL,water well(s),single or multiple shafts sunk into the ground to reach and tap a supply of water,Center of Feature,H - Hydrographic
WLLQ,abandoned well,abandoned well,Center of Feature,H - Hydrographic
WRCK,wreck,the site of the remains of a wrecked vessel,Center of Feature,S - Spot Features
WTLD,wetland,"an area subject to inundation, usually characterized by bog, marsh, or swamp vegetation",Center of Feature,H - Hydrographic
WTLDI,intermittent wetland,intermittent wetland,Center of Feature,H - Hydrographic
WTRH,waterhole(s),"natural hole(s), hollow(s), or small depression(s) that contain(s) water, used by man and animals, especially in arid areas",Center of Feature,H - Hydrographic
WTRW,waterworks,a facility for supplying potable water through a water source and a system of pumps and filtration beds,Center of Feature,S - Spot Features
ZNB,buffer zone,"a delimited area separating two, or more, political entities or territories, within which certain activities are limited or prohibited",Center of Feature,A - Administrative Regions
ZNF,free trade zone,"an area, usually a section of a port, where goods may be received and shipped free of customs duty and of most customs regulations",Center of Feature,S - Spot Features
ZOO,zoo,a zoological garden or park where wild animals are kept for exhibition,Center of Feature,S - Spot Features
