Feature Designation Code,Feature Designation Name,Feature Designation Text,Feature Class
SPIT,spit,"a narrow, straight or curved continuation of a beach into a waterbody",T
SPLY,spillway,"a passage or outlet through which surplus water flows over, around or through a dam",S
SPNG,spring(s),a place where ground water flows naturally out of the ground,H
SPNS,sulphur spring(s),a place where sulphur ground water flows naturally out of the ground,H
SPNT,hot spring(s),a place where hot ground water flows naturally out of the ground,H
SPRU,undersea spur,"a subordinate elevation, ridge, or rise projecting outward from a larger feature",U
SPUR,spur(s),"a subordinate ridge projecting outward from a hill, mountain or other elevation",T
SQR,square,"a broad, open, public area near the center of a town or city",S
ST,street,a paved urban thoroughfare,R
STBL,stable,"a building for the shelter and feeding of farm animals, especially horses",S
STDM,stadium,a structure with an enclosure for athletic games with tiers of seats for spectators,S
STKR,stock route,a route taken by livestock herds,R
STLMT,Israeli settlement,,P
STM,stream,a body of running water moving to a lower level in a channel on land,H
STMA,anabranch,a diverging branch flowing out of a main stream and rejoining it downstream,H
STMB,stream bend,a conspicuously curved or bent segment of a stream,H
STMC,canalized stream,"a stream that has been substantially ditched, diked, or straightened",H
STMD,distributary(-ies),"a branch which flows away from the main stream, as in a delta or irrigation canal",H
STMGS,stream gauging station,"named place where a measuring station for a watercourse, reservoir or other water body exists",S
STMH,headwaters,"the source and upper part of a stream, including the upper drainage basin",H
STMI,intermittent stream,,H
STMIX,section of intermittent stream,,H
STMM,stream mouth(s),"a place where a stream discharges into a lagoon, lake, or the sea",H
STMQ,abandoned watercourse,"a former stream or distributary no longer carrying flowing water, but still evident due to lakes, wetland, topographic or vegetation patterns",H
STMS,streams,bodies of running water moving to a lower level in a channel on land,H
STMSB,lost river,"a surface stream that disappears into an underground channel, or dries up in an arid area",H
STMX,section of stream,,H
STNB,scientific research base,a scientific facility used as a base from which research is carried out or monitored,S
STNC,coast guard station,a facility from which the coast is guarded by armed vessels,S
STNE,experiment station,a facility for carrying out experiments,S
STNF,forest station,a collection of buildings and facilities for carrying out forest management,S
STNI,inspection station,"a station at which vehicles, goods, and people are inspected",S
STNM,meteorological station,a station at which weather elements are recorded,S
STNR,radio station,a facility for producing and transmitting information by radio waves,S
STNS,satellite station,a facility for tracking and communicating with orbiting satellites,S
STNW,whaling station,a facility for butchering whales and processing train oil,S
STPS,steps,stones or slabs placed for ease in ascending or descending a steep slope,S
STRT,strait,"a relatively narrow waterway, usually narrower and less extensive than a sound, connecting two larger bodies of water",H
SUBS,subway station,"a facility comprising ticket office, platforms, etc. for loading and unloading subway passengers",S
SUBW,subway,"a railroad used for mass public transportation primarily in urban areas, all or part of the system may be located below, above, or at ground level",S
SWMP,swamp,a wetland dominated by tree vegetation,H
SWT,sewage treatment plant,facility for the processing of sewage and/or wastewater,S
SYSI,irrigation system,"a network of ditches and one or more of the following elements: water supply, reservoir, canal, pump, well, drain, etc.",H
TAL,talus slope,a steep concave slope formed by an accumulation of loose rock fragments at the base of a cliff or steep slope,T
TERR,territory,,A
TERU,undersea terrace,"a relatively flat horizontal or gently inclined surface, sometimes long and narrow, which is bounded by a steeper ascending slope on one side and by a steep descending slope on the opposite side",U
THTR,theater,"A building, room, or outdoor structure for the presentation of plays, films, or other dramatic performances",S
TMB,tomb(s),a structure for interring bodies,S
TMPL,temple(s),an edifice dedicated to religious worship,S
TMSU,tablemounts (or guyots),"seamounts having a comparatively smooth, flat top",U
TMTU,tablemount (or guyot),"a seamount having a comparatively smooth, flat top",U
TNGU,undersea tongue,an elongate (tongue-like) extension of a flat sea floor into an adjacent higher feature,U
TNKD,cattle dipping tank,a small artificial pond used for immersing cattle in chemically treated water for disease control,S
TNL,tunnel,a subterranean passageway for transportation,R
TNLC,canal tunnel,a tunnel through which a canal passes,H
TNLN,natural tunnel,a cave that is open at both ends,R
TNLRD,road tunnel,a tunnel through which a road passes,R
TNLRR,railroad tunnel,a tunnel through which a railroad passes,R
TNLS,tunnels,subterranean passageways for transportation,R
TOLL,toll gate/barrier,highway toll collection station,S
TOWR,tower,"a high conspicuous structure, typically much higher than its diameter",S
TRANT,transit terminal,facilities for the handling of vehicular freight and passengers,S
TRB,tribal area,a tract of land used by nomadic or other tribes,L
TREE,tree(s),a conspicuous tree used as a landmark,V
TRGD,interdune trough(s),a long wind-swept trough between parallel longitudinal dunes,T
TRGU,undersea trough,"a long depression of the sea floor characteristically flat bottomed and steep sided, and normally shallower than a trench",U
TRIG,triangulation station,a point on the earth whose position has been determined by triangulation,S
TRL,trail,"a path, track, or route used by pedestrians, animals, or off-road vehicles",R
TRMO,oil pipeline terminal,a tank farm or loading facility at the end of an oil pipeline,S
TRNU,undersea trench,"a long, narrow, characteristically very deep and asymmetrical depression of the sea floor, with relatively steep sides",U
TRR,terrace,"a long, narrow alluvial platform bounded by steeper slopes above and below, usually overlooking a waterbody",T
TUND,tundra,"a marshy, treeless, high latitude plain, dominated by mosses, lichens, and low shrub vegetation under permafrost conditions",V
TWO,temp work office,Temporary Work Offices,S
UFHU,historical undersea feature,an undersea feature whose existence has been subsequently disproved,U
UNIP,university prep school,University Preparation Schools & Institutions,S
UNIV,university,An institution for higher learning with teaching and research facilities constituting a graduate school and professional schools that award master's degrees and doctorates and an undergraduate division that awards bachelor's degrees.,S
UPLD,upland,an extensive interior region of high land with low to moderate surface relief,T
USGE,United States Government Establishment,a facility operated by the United States Government in Panama,S
VAL,valley,an elongated depression usually traversed by a stream,T
VALG,hanging valley,a valley the floor of which is notably higher than the valley or shore to which it leads; most common in areas that have been glaciated,T
VALS,valleys,elongated depressions usually traversed by a stream,T
VALU,undersea valley,"a relatively shallow, wide depression, the bottom of which usually has a continuous gradient",U
VALX,section of valley,,T
VETF,veterinary facility,a building or camp at which veterinary services are available,S
VIN,vineyard,a planting of grapevines,V
VINS,vineyards,plantings of grapevines,V
VLC,volcano,a conical elevation composed of volcanic materials with a crater at the top,T
VLSU,undersea valleys,"a relatively shallow, wide depression, the bottom of which usually has a continuous gradient",U
WAD,wadi,"a valley or ravine, bounded by relatively steep banks, which in the rainy season becomes a watercourse; found primarily in North Africa and the Middle East",H
WADB,wadi bend,a conspicuously curved or bent segment of a wadi,H
WADJ,wadi junction,a place where two or more wadies join,H
WADM,wadi mouth,"the lower terminus of a wadi where it widens into an adjoining floodplain, depression, or waterbody",H
WADS,wadies,"valleys or ravines, bounded by relatively steep banks, which in the rainy season become watercourses; found primarily in North Africa and the Middle East",H
WADX,section of wadi,,H
WALL,wall,"a thick masonry structure, usually enclosing a field or building, or forming the side of a structure",S
WALLA,ancient wall,the remains of a linear defensive stone structure,S
WEIR,weir(s),"a small dam in a stream, designed to raise the water level or to divert stream flow through a desired channel",S
WHRF,wharf(-ves),a structure of open rather than solid construction along a shore or a bank which provides berthing for ships and cargo-handling facilities,S
WHRL,whirlpool,"a turbulent, rotating movement of water in a stream",H
WLL,well,"a cylindrical hole, pit, or tunnel drilled or dug down to a depth from which water, oil, or gas can be pumped or brought to the surface",H
WLLQ,abandoned well,,H
WLLS,wells,"cylindrical holes, pits, or tunnels drilled or dug down to a depth from which water, oil, or gas can be pumped or brought to the surface",H
WRCK,wreck,the site of the remains of a wrecked vessel,S
WTLD,wetland,"an area subject to inundation, usually characterized by bog, marsh, or swamp vegetation",H
WTLDI,intermittent wetland,,H
WTRC,watercourse,"a natural, well-defined channel produced by flowing water, or an artificial channel designed to carry flowing water",H
WTRH,waterhole(s),"a natural hole, hollow, or small depression that contains water, used by man and animals, especially in arid areas",H
WTRW,waterworks,a facility for supplying potable water through a water source and a system of pumps and filtration beds,S
ZN,zone,,A
ZNB,buffer zone,a zone recognized as a buffer between two nations in which military presence is minimal or absent,A
ZNF,free trade zone,"an area, usually a section of a port, where goods may be received and shipped free of customs duty and of most customs regulations",S
ZOO,zoo,a zoological garden or park where wild animals are kept for exhibition,S
