Feature_Designation_Code,Feature_Designation_Name,Feature_Designation_Description,Collection_Guidance,Feature_Class
FYT,ferry terminal ,"a place where ferries pick-up and discharge passengers, vehicles and or cargo",Center of Feature,S - Spot Features
GAP,gap,"a low place in a ridge, not used for transportation",Center of Feature,T - Hypsographic
GAPU,undersea gap,a narrow break in a ridge or rise,Center of Feature (modification/addition requires ACUF approval),U - Undersea
GARG,parking garage,a building or underground facility used exclusively for parking vehicles,Center of Feature,S - Spot Features
GASF,gasfield,an area containing a subterranean store of natural gas of economic value,Center of Feature,L - Areas/Localities
GATE,gate,a barrier on a transportation route that controls passage along that route,Center of Feature,S - Spot Features
GDN,garden(s),enclosure(s) for displaying selected plant or animal life,Center of Feature,S - Spot Features
GHAT,ghāt,"a set of steps leading to a river, which are of religious significance, and at their base is usually a platform for bathing",Center of Feature,S - Spot Features
GHSE,guest house,a house used to provide lodging for paying guests,Center of Feature,S - Spot Features
GLCR,glacier(s),"mass(es) of ice, usually at high latitudes or high elevations, with sufficient thickness to flow away from the source area in lobes, tongues, or masses",Center of Feature,H - Hydrographic
GLYU,undersea gully,a small valley-like feature,Center of Feature (modification/addition requires ACUF approval),U - Undersea
GOSP,gas-oil separator plant,a facility for separating gas from oil,Center of Feature,S - Spot Features
GRAZ,grazing area,an area of grasses and shrubs used for grazing,Center of Feature,L - Areas/Localities
GRGE,gorge(s),"short, narrow, steep-sided section(s) of a stream valley",Center of Feature,T - Hypsographic
GROVE,grove,"a small wooded area or collection of trees growing closely together, occurring naturally or deliberately planted",Center of Feature,V - Vegetation
GRSLD,grassland,an area dominated by grass vegetation,Center of Feature,V - Vegetation
GRVE,grave,a burial site,Center of Feature,S - Spot Features
GULF,gulf,"a large recess in the coastline, larger than a bay",Center of Feature,H - Hydrographic
GVL,gravel area,an area covered with gravel,Center of Feature,L - Areas/Localities
GYSR,geyser,a type of hot spring with intermittent eruptions of jets of hot water and steam,Center of Feature,H - Hydrographic
HBR,harbor(s),haven(s) or space(s) of deep water so sheltered by the adjacent land as to afford a safe anchorage for ships,Center of Feature,H - Hydrographic
HBRX,section of harbor,section of harbor,Center of Feature,H - Hydrographic
HDLD,headland,a high projection of land extending into a large body of water beyond the line of the coast,Center of Feature,T - Hypsographic
HERM,hermitage,"a secluded residence, usually for religious sects",Center of Feature,S - Spot Features
HLL,hill,a rounded elevation of limited extent rising above the surrounding land with local relief of less than 300m,Center of Feature,T - Hypsographic
HLLS,hills,rounded elevations of limited extent rising above the surrounding land with local relief of less than 300m,Center of Feature,T - Hypsographic
HLLU,undersea hill,an elevation rising generally less than 500 meters,Center of Feature (modification/addition requires ACUF approval),U - Undersea
HLSU,undersea hills,elevations rising generally less than 500 meters,Center of Feature (modification/addition requires ACUF approval),U - Undersea
HLT,halting place,a place where caravans stop for rest,Center of Feature,S - Spot Features
HMCK,hammock(s),"patch(es) of ground, distinct from and slightly above the surrounding plain or wetland",Center of Feature,T - Hypsographic
HMDA,rock desert,"a relatively sand-free, high bedrock plateau in a hot desert, with or without a gravel veneer",Center of Feature,T - Hypsographic
HMSD,homestead,"a residence, owner's or manager's, on a sheep or cattle station, woolshed, outcamp, or Aboriginal outstation, specific to Australia and New Zealand",Center of Feature,S - Spot Features
HOLU,undersea hole,a small depression of the sea floor,Center of Feature (modification/addition requires ACUF approval),U - Undersea
HSE,house(s),a building or buildings used as human habitation,Center of Feature,S - Spot Features
HSEC,country house,"a large house, mansion, or chateau, on a large estate",Center of Feature,S - Spot Features
HSP,hospital,"a building in which sick or injured, especially those confined to bed, are medically treated",Center of Feature,S - Spot Features
HSPC,clinic,facility which provides medical or surgical treatment for the ill or wounded on an out-patient basis (for example: at a clinic or dispensary),Center of Feature,S - Spot Features
HSPL,leprosarium,an asylum or hospital for lepers,Center of Feature,S - Spot Features
HSTS,historical site,a place of historical importance,Center of Feature,S - Spot Features
HTH,heath,an upland moor or sandy area dominated by low shrubby vegetation including heather,Center of Feature,V - Vegetation
HTL,hotel,a building providing lodging and/or meals for the public,Center of Feature,S - Spot Features
HUT,hut(s),"single or multiple, small, free standing, self-contained residence(s) usually having only a single multi-function room",Center of Feature,S - Spot Features
INDS,industrial area,an area characterized by industrial activity,Center of Feature,L - Areas/Localities
INLT,inlet,"a narrow waterway extending into the land, or connecting a bay or lagoon with a larger body of water",Center of Feature,H - Hydrographic
INSM,military installation,an installation designed for and used by the military,Center of Feature,S - Spot Features
INTF,interfluve,a relatively undissected upland between adjacent stream valleys,Center of Feature,T - Hypsographic
ISL,island,"a tract of land, smaller than a continent, surrounded by water at high water",Center of Feature,T - Hypsographic
ISLF,artificial island,"an island created by landfill or diking and filling in a wetland, bay, or lagoon",Center of Feature,T - Hypsographic
ISLM,mangrove island,a mangrove swamp surrounded by a waterbody,Center of Feature,T - Hypsographic
ISLS,islands,"tracts of land, smaller than a continent, surrounded by water at high water",Center of Feature,T - Hypsographic
ISLT,land-tied island,"a coastal island connected to the mainland by barrier beaches, levees or dikes",Center of Feature,T - Hypsographic
ISLX,section of island,section of island,Center of Feature,T - Hypsographic
ISTH,isthmus,a narrow strip of land connecting two larger land masses and bordered by water,Center of Feature,T - Hypsographic
ITTR,research institute,a facility where research is carried out,Center of Feature,S - Spot Features
JTY,jetty,a structure built out into the water at a river mouth or harbor entrance to regulate currents and silting,Center of Feature,S - Spot Features
KNLU,undersea knoll,"an elevation rising generally more than 500 meters and less than 1,000 meters and of limited extent across the summit",Center of Feature (modification/addition requires ACUF approval),U - Undersea
KNSU,undersea knolls,"elevations rising generally more than 500 meters and less than 1,000 meters and of limited extent across the summits",Center of Feature (modification/addition requires ACUF approval),U - Undersea
KRST,karst area,"a distinctive landscape developed on soluble rock such as limestone characterized by sinkholes, caves, disappearing streams, and underground drainage",Center of Feature,T - Hypsographic
LAND,Arctic land,a tract of land in the Arctic,Center of Feature,L - Areas/Localities
LAVA,lava area,an area of solidified lava,Center of Feature,T - Hypsographic
LBED,lake bed(s),dried up or drained area(s) of former lake(s),Center of Feature,H - Hydrographic
LCTY,locality,a minor area or place of unspecified or mixed character and indefinite boundaries,Center of Feature,L - Areas/Localities
LDGU,undersea ledge,"a rocky projection or outcrop, commonly linear and near shore",Center of Feature (modification/addition requires ACUF approval),U - Undersea
LDNG,landing,"a place where boats receive or discharge passengers and freight, but lacking most port facilities",Center of Feature,S - Spot Features
LEPC,leper colony,a settled area inhabited by lepers in relative isolation,Center of Feature,P - Populated Places
LEV,levee,a natural low embankment bordering a distributary or meandering stream; often built up artificially to control floods,Center of Feature,T - Hypsographic
LEVU,undersea levee,"an embankment bordering a canyon, valley, or seachannel",Center of Feature (modification/addition requires ACUF approval),U - Undersea
LGHSE,longhouse,"a long, narrow, often single-room structure, used as a communal dwelling by large extended families and kinship groups",Center of Feature,S - Spot Features
LGN,lagoon(s),"shallow coastal waterbody(-ies), completely or partly separated from a larger body of water by a barrier island, coral reef or other depositional feature",Center of Feature,H - Hydrographic
LGNX,section of lagoon,section of lagoon,Center of Feature,H - Hydrographic
LIB,library,"a building housing a curated collection of information resources, which may include books, periodicals, audiovisual and reference materials",Center of Feature,S - Spot Features
LK,lake,a large inland body of standing water,Center of Feature,H - Hydrographic
LKC,crater lake(s),body(-ies) of water formed by the collection of water in the crater of an inactive volcano,Center of Feature,H - Hydrographic
LKI,intermittent lake(s),large inland body(-ies) of water that are filled for part of the year only,Center of Feature,H - Hydrographic
LKN,salt lake(s),large inland body(-ies) of salt water with no outlet,Center of Feature,H - Hydrographic
LKNI,intermittent salt lake(s),large inland body(-ies) of salt water that are filled for part of the year only,Center of Feature,H - Hydrographic
LKO,oxbow lake,a crescent-shaped lake commonly found adjacent to meandering streams,Center of Feature,H - Hydrographic
LKOI,intermittent oxbow lake,intermittent oxbow lake,Center of Feature,H - Hydrographic
LKS,lakes,large inland bodies of standing water,Center of Feature,H - Hydrographic
LKSB,underground lake,a standing body of water in a cave,Center of Feature,H - Hydrographic
LKX,section of lake,section of lake,Center of Feature,H - Hydrographic
LNDF,landfill,a place for trash and garbage disposal in which the waste is buried between layers of earth to build up low-lying land,Center of Feature,S - Spot Features
LOCK,lock(s),basin(s) in a waterway with gates at each end by means of which vessels are passed from one water level to another,Center of Feature,S - Spot Features
LTER,leased area,a tract of land leased by the United Kingdom from the People's Republic of China to form part of Hong Kong,Center of Feature,A - Administrative Regions
LTHSE,lighthouse,a distinctive structure exhibiting a major navigation light,Center of Feature,S - Spot Features
MAR,marina,"a harbor facility for small boats, yachts, etc.",Center of Feature,S - Spot Features
MDVU,undersea median valley,the axial depression of the mid-oceanic ridge system,Center of Feature (modification/addition requires ACUF approval),U - Undersea
MDW,meadow,"a small, poorly drained area dominated by grassy vegetation",Center of Feature,V - Vegetation
MESA,mesa(s),"flat-topped, isolated elevation(s) with steep slopes on all sides, less extensive than a plateau",Center of Feature,T - Hypsographic
MESU,undersea mesa,"an isolated, extensive, flat-topped elevation on the shelf, with relatively steep sides",Center of Feature (modification/addition requires ACUF approval),U - Undersea
MFG,factory,"one or more buildings where goods are manufactured, processed or fabricated",Center of Feature,S - Spot Features
MFGB,brewery,one or more buildings where beer is brewed,Center of Feature,S - Spot Features
MFGC,cannery,a building where food items are canned,Center of Feature,S - Spot Features
MFGCU,copper works,a facility for processing copper ore,Center of Feature,S - Spot Features
MFGLM,limekiln,a furnace in which limestone is reduced to lime,Center of Feature,S - Spot Features
MFGM,munitions plant,a factory where ammunition is made,Center of Feature,S - Spot Features
MFGN,salt evaporation ponds,diked salt ponds used in the production of solar evaporated salt,Center of Feature,H - Hydrographic
MFGPH,phosphate works,a facility for producing fertilizer,Center of Feature,S - Spot Features
MFGQ,abandoned factory,abandoned factory,Center of Feature,S - Spot Features
MFGSG,sugar refinery,a facility for converting raw sugar into refined sugar,Center of Feature,S - Spot Features
MGV,mangrove swamp,a tropical tidal mud flat characterized by mangrove vegetation,Center of Feature,H - Hydrographic
MKT,market,a place where goods are bought and sold at regular intervals,Center of Feature,S - Spot Features
ML,mill(s),"building(s) housing machines for transforming, shaping, finishing, grinding, or extracting products",Center of Feature,S - Spot Features
MLM,ore treatment plant,a facility for improving the metal content of ore by concentration,Center of Feature,S - Spot Features
MLO,olive oil mill,a mill where oil is extracted from olives,Center of Feature,S - Spot Features
MLSG,sugar mill,a facility where sugar cane is processed into raw sugar,Center of Feature,S - Spot Features
MLSGQ,former sugar mill,a sugar mill no longer used as a sugar mill,Center of Feature,S - Spot Features
MLSW,sawmill,a mill where logs or lumber are sawn to specified shapes and sizes,Center of Feature,S - Spot Features
MLWND,windmill,a mill or water pump powered by wind,Center of Feature,S - Spot Features
MLWTR,water mill,a mill powered by running water,Center of Feature,S - Spot Features
MN,mine(s),site(s) where mineral ores are extracted from the ground by excavating surface pits and subterranean passages,Center of Feature,S - Spot Features
MNA,mining area,an area of mine sites where minerals and ores are extracted,Center of Feature,L - Areas/Localities
MNAU,gold mine(s),"mine(s) where gold ore, or alluvial gold is extracted",Center of Feature,S - Spot Features
MNC,coal mine(s),mine(s) where coal is extracted,Center of Feature,S - Spot Features
MNCR,chrome mine(s),mine(s) where chrome ore is extracted,Center of Feature,S - Spot Features
MNCU,copper mine(s),mine(s) where copper ore is extracted,Center of Feature,S - Spot Features
MND,mound(s),"low, isolated, rounded hill(s)",Center of Feature,T - Hypsographic
MNDT,diatomite mine(s),place(s) where diatomaceous earth is extracted,Center of Feature,S - Spot Features
MNDU,undersea mound,"a low, isolated, rounded hill",Center of Feature (modification/addition requires ACUF approval),U - Undersea
MNFE,iron mine(s),mine(s) where iron ore is extracted,Center of Feature,S - Spot Features
MNMT,monument,a commemorative structure or statue,Center of Feature,S - Spot Features
MNN,salt mine(s),mine(s) from which salt is extracted,Center of Feature,S - Spot Features
MNNI,nickel mine(s),mine(s) where nickel ore is extracted,Center of Feature,S - Spot Features
MNPB,lead mine(s),mine(s) where lead ore is extracted,Center of Feature,S - Spot Features
MNPL,placer mine(s),place(s) where heavy metals are concentrated and running water is used to extract them from unconsolidated sediments,Center of Feature,S - Spot Features
MNQ,abandoned mine,abandoned mine,Center of Feature,S - Spot Features
MNQR,quarry(-ies),"surface mine(s) where building stone or gravel and sand, etc. are extracted",Center of Feature,S - Spot Features
MNSN,tin mine(s),mine(s) where tin ore is extracted,Center of Feature,S - Spot Features
MOLE,mole,a massive structure of masonry or large stones serving as a pier or breakwater,Center of Feature,S - Spot Features
MOOR,moor(s),area(s) of open ground overlaid with wet peaty soils,Center of Feature,H - Hydrographic
MOTU,undersea moat,"an annular depression that may not be continuous, located at the base of many seamounts, islands, and other isolated elevations",Center of Feature (modification/addition requires ACUF approval),U - Undersea
MRN,moraine,"a mound, ridge, or other accumulation of glacial till",Center of Feature,T - Hypsographic
MRSH,marsh(es),wetland(s) dominated by grass-like vegetation,Center of Feature,H - Hydrographic
MRSHN,salt marsh,"a flat area, subject to periodic salt water inundation, dominated by grassy salt-tolerant plants",Center of Feature,H - Hydrographic
MSQE,mosque,a building for public Islamic worship,Center of Feature,S - Spot Features
MSSN,mission,"a place characterized by dwellings, school, church, hospital and other facilities operated by a religious group for the purpose of providing charitable services and to propagate religion",Center of Feature,S - Spot Features
MSSNQ,abandoned mission,abandoned mission,Center of Feature,S - Spot Features
MSTY,monastery,a building and grounds where a community of monks lives in seclusion,Center of Feature,S - Spot Features
MT,mountain,"an elevation standing high above the surrounding area with small summit area, steep slopes and local relief of 300m or more",Center of Feature,T - Hypsographic
MTS,mountains,a mountain range or a group of mountains or high ridges,Center of Feature,T - Hypsographic
MTSU,undersea mountains,well-delineated subdivisions of a large and complex positive feature,Center of Feature (modification/addition requires ACUF approval),U - Undersea
MTU,undersea mountain,a well-delineated subdivision of a large and complex positive feature,Center of Feature (modification/addition requires ACUF approval),U - Undersea
MUS,museum,a building where objects of permanent interest in one or more of the arts and sciences are preserved and exhibited,Center of Feature,S - Spot Features
MVA,maneuver area,a tract of land where military field exercises are carried out,Center of Feature,L - Areas/Localities
NKM,meander neck,a narrow strip of land between the two limbs of a meander loop at its narrowest point,Center of Feature,T - Hypsographic
NOV,novitiate,a religious house or school where novices are trained,Center of Feature,S - Spot Features
NRWS,narrows,"a navigable narrow part of a bay, strait, river, etc.",Center of Feature,H - Hydrographic
NSY,nursery(-ies),place(s) where plants are propagated for transplanting or grafting,Center of Feature,S - Spot Features
NTK,nunatak,a rock or mountain peak protruding through glacial ice,Center of Feature,T - Hypsographic
NTKS,nunataks,rocks or mountain peaks protruding through glacial ice,Center of Feature,T - Hypsographic
NVB,naval base,"an area used to store supplies, provide barracks for troops and naval personnel, a port for naval vessels, and from which operations are initiated",Center of Feature,L - Areas/Localities
OAS,oasis(-es),an area in a desert made productive by the availability of water,Center of Feature,L - Areas/Localities
OBPT,observation point,a wildlife or scenic observation point,Center of Feature,S - Spot Features
OBS,observatory,a facility equipped for observation of atmospheric or space phenomena,Center of Feature,S - Spot Features
OBSR,radio observatory,a facility equipped with an array of antennae for receiving radio waves from space,Center of Feature,S - Spot Features
OCH,orchard(s),planting(s) of fruit or nut trees,Center of Feature,V - Vegetation
OCN,ocean,one of the major divisions of the vast expanse of salt water covering part of the earth,Center of Feature (changes to primary name or designation require BGN/FNC approval),H - Hydrographic
OILF,oilfield,an area containing a subterranean store of petroleum of economic value,Center of Feature,L - Areas/Localities
OILJ,oil pipeline junction,a section of an oil pipeline where two or more pipes join together,Center of Feature,S - Spot Features
OILP,oil pipeline,a pipeline used for transporting oil,At Dispersal Point,R - Transportation Networks
OILQ,abandoned oil well,abandoned oil well,Center of Feature,S - Spot Features
OILR,oil refinery,a facility for converting crude oil into refined petroleum products,Center of Feature,S - Spot Features
OILT,tank farm,"a tract of land occupied by large, cylindrical, metal tanks in which oil or liquid petrochemicals are stored",Center of Feature,S - Spot Features
OILW,oil well,a well from which oil may be pumped,Center of Feature,S - Spot Features
OVF,overfalls,an area of breaking waves caused by the meeting of currents or by waves moving against the current,Center of Feature,H - Hydrographic
PAL,palace,"a large stately house, often a royal or presidential residence",Center of Feature,S - Spot Features
PAN,pan(s),"near-level shallow, natural depression(s) or basin(s), usually containing an intermittent lake, pond, or pool",Center of Feature,T - Hypsographic
PASS,pass,"a break in a mountain range or other high obstruction, used for transportation from one side to the other [See also gap]",Center of Feature,T - Hypsographic
PCL,political entity,political entity,Center of Feature (changes to primary name or designation require BGN/FNC approval),A - Administrative Regions
PCLD,dependent political entity,dependent political entity,Center of Feature (changes to primary name or designation require BGN/FNC approval),A - Administrative Regions
PCLI,independent political entity,independent political entity,Center of Feature (changes to primary name or designation require BGN/FNC approval),A - Administrative Regions
PCLIX,section of independent political entity,section of independent political entity,Center of Feature (changes to primary name or designation require BGN/FNC approval),A - Administrative Regions
PEAT,peat cutting area,an area where peat is harvested,Center of Feature,L - Areas/Localities
PEN,peninsula,an elongate area of land projecting into a body of water and nearly surrounded by water,Center of Feature,T - Hypsographic
PENX,section of peninsula,section of peninsula,Center of Feature,T - Hypsographic
PGDA,pagoda,"a tower-like storied structure, usually a Buddhist shrine",Center of Feature,S - Spot Features
PIER,pier,a structure built out into navigable water on piles providing berthing for ships and recreation,Center of Feature,S - Spot Features
PK,peak(s),"pointed elevation(s) atop a mountain, ridge, or other hypsographic feature",Center of Feature,T - Hypsographic
PKLT,parking lot,an area used for parking vehicles,Center of Feature,S - Spot Features
PKSU,undersea peaks,"prominent elevations, part of a larger feature, either pointed or of very limited extent across the summit",Center of Feature (modification/addition requires ACUF approval),U - Undersea
PKU,undersea peak,"a prominent elevation, part of a larger feature, either pointed or of very limited extent across the summit",Center of Feature (modification/addition requires ACUF approval),U - Undersea
PLAT,plateau,"an elevated plain with steep slopes on one or more sides, and often with incised streams",Center of Feature,T - Hypsographic
PLATX,section of plateau,section of plateau,Center of Feature,T - Hypsographic
PLDR,polder,an area reclaimed from the sea by diking and draining,Center of Feature,T - Hypsographic
PLFU,undersea platform,a flat or gently sloping underwater surface extending seaward from the shore,Center of Feature (modification/addition requires ACUF approval),U - Undersea
PLN,plain(s),"extensive area(s) of comparatively level to gently undulating land, lacking surface irregularities, and usually adjacent to a higher area",Center of Feature,T - Hypsographic
PLNU,undersea plain,"a flat, gently sloping or nearly level region",Center of Feature (modification/addition requires ACUF approval),U - Undersea
PLNX,section of plain,section of plain,Center of Feature,T - Hypsographic
PLTU,undersea plateau,"a comparatively flat-topped feature of considerable extent, dropping off abruptly on one or more sides",Center of Feature (modification/addition requires ACUF approval),U - Undersea
PMPO,oil pumping station,a facility for pumping oil through a pipeline,Center of Feature,S - Spot Features
PMPW,water pumping station,a facility for pumping water from a major well or through a pipeline,Center of Feature,S - Spot Features
PND,pond(s),small standing waterbody(-ies),Center of Feature,H - Hydrographic
PNDI,intermittent pond(s),small standing waterbody(-ies) that are filled for part of the year,Center of Feature,H - Hydrographic
PNDN,salt pond(s),"small standing body(-ies) of salt water often in a marsh or swamp, usually along a seacoast",Center of Feature,H - Hydrographic
PNDNI,intermittent salt pond(s),intermittent salt pond(s),Center of Feature,H - Hydrographic
PNDSF,fishponds,ponds or enclosures in which fish are kept or raised,Center of Feature,H - Hydrographic
PNLU,undersea pinnacle,"a high tower or spire-shaped pillar of rock or coral, alone or cresting a summit",Center of Feature (modification/addition requires ACUF approval),U - Undersea
PO,post office,"a public building in which mail is received, sorted and distributed",Center of Feature,S - Spot Features
POOL,pool(s),"small and comparatively still, deep part(s) of a larger body of water such as a stream or harbor; or small body(-ies) of standing water",Center of Feature,H - Hydrographic
POOLI,intermittent pool,intermittent pool,Center of Feature,H - Hydrographic
PP,police post,a building in which police are stationed,Center of Feature,S - Spot Features
PPL,populated place,"a city, town, village, or other agglomeration of buildings where people live and work",Center of Feature,P - Populated Places
PPLA,seat of a first-order administrative division,seat of a primary administrative division (PPLC takes precedence over PPLA),Center of Feature (changes to primary name or designation require BGN/FNC approval),P - Populated Places
PPLA2,seat of a second-order administrative division,seat of a second-order administrative division,Center of Feature,P - Populated Places
