Feature_Designation_Code,Feature_Designation_Name,Feature_Designation_Description,Collection_Guidance,Feature_Class
PPLA3,seat of a third-order administrative division,seat of a third-order administrative division,Center of Feature,P - Populated Places
PPLA4,seat of a fourth-order administrative division,seat of a fourth-order administrative division,Center of Feature,P - Populated Places
PPLC,capital of an independent state,capital of a political entity designated as an independent state,Center of Feature (changes to primary name or designation require BGN/FNC approval),P - Populated Places
PPLCD,capital of a dependency or special area,capital or administrative center of a dependent political territory or area of special sovereignty,Center of Feature (changes to primary name or designation require BGN/FNC approval),P - Populated Places
PPLF,farm village,a populated place where the population is largely engaged in agricultural activities,Center of Feature,P - Populated Places
PPLL,populated locality,an area similar to a locality but with a small group of dwellings or other buildings,Center of Feature,P - Populated Places
PPLQ,abandoned populated place,abandoned populated place,Center of Feature,P - Populated Places
PPLR,religious populated place,a populated place whose population is largely engaged in religious occupations,Center of Feature,P - Populated Places
PPLW,destroyed populated place,"a village, town or city destroyed by a natural disaster, or by war",Center of Feature,P - Populated Places
PPLX,section of populated place,section of populated place,Center of Feature,P - Populated Places
PPQ,abandoned police post,abandoned police post,Center of Feature,S - Spot Features
PRK,park,"an area of defined limits which is set aside for human recreation and enjoyment and/or for historic preservation purposes, and is usually maintained in a natural, semi-natural, or ornamentally planted state",Center of Feature,L - Areas/Localities
PRKHQ,park headquarters,a park administrative facility,Center of Feature,S - Spot Features
PRMN,promenade,"a place for public walking, usually along a beach front",Center of Feature,R - Transportation Networks
PRN,prison,a facility for confining prisoners,Center of Feature,S - Spot Features
PRNC,prison camp,"a prison or facility used for the temporary preventative confinement of people, often in large groups",Center of Feature,S - Spot Features
PRNJ,reformatory,"a facility for confining, training, and reforming young law offenders",Center of Feature,S - Spot Features
PRNQ,abandoned prison,abandoned prison,Center of Feature,S - Spot Features
PROM,promontory(-ies),bluff(s) or prominent hill(s) overlooking or projecting into a lowland,Center of Feature,T - Hypsographic
PRSH,parish,an ecclesiastical district,Center of Feature,A - Administrative Regions
PRT,port,"a place provided with terminal and transfer facilities for loading and discharging waterborne cargo or passengers, usually located in a harbor",Center of Feature,L - Areas/Localities
PRVU,undersea province,a region identifiable by a group of similar physiographic features whose characteristics are markedly in contrast with surrounding areas,Center of Feature (modification/addition requires ACUF approval),U - Undersea
PS,power station,a facility for generating electric power,Center of Feature,S - Spot Features
PSH,hydroelectric power station,a building where electricity is generated from water power,Center of Feature,S - Spot Features
PSN,nuclear power station,nuclear power station,Center of Feature,S - Spot Features
PSS,power substation,"a facility, along a power transmission line, in which electric current is switched, transformed, and/or converted",Center of Feature,S - Spot Features
PSTB,border post,a post or station at an international boundary for the regulation of movement of people and goods,Center of Feature,S - Spot Features
PSTP,patrol post,a post from which patrols are sent out,Center of Feature,S - Spot Features
PSW,wind farm,a collection of wind turbines that are collocated and organized as a single power-generation unit,Center of Feature,S - Spot Features
PT,point(s),"tapering piece(s) of land projecting into a body of water, less prominent than a cape",Center of Feature,T - Hypsographic
PTGE,portage,"a place where boats, goods, etc., are carried overland between navigable waters",Center of Feature,R - Transportation Networks
PYR,pyramid(s),ancient massive structure(s) of square ground plan with four triangular faces meeting at a point and used for enclosing tombs,Center of Feature,S - Spot Features
QCKS,quicksand,"an area where loose sand with water moving through it may become unstable when heavy objects are placed at the surface, causing them to sink",Center of Feature,L - Areas/Localities
QUAY,quay,a structure of solid construction along a shore or bank which provides berthing for ships and which generally provides cargo handling facilities,Center of Feature,S - Spot Features
RAVU,undersea ravine,a small canyon,Center of Feature (modification/addition requires ACUF approval),U - Undersea
RCH,reach,a straight section of a navigable stream or channel between two bends,Center of Feature,H - Hydrographic
RD,road,"an open way with improved surface for transportation of animals, people and vehicles","Westernmost End (When feature is North to South Oriented, Southernmost End)",R - Transportation Networks
RDA,ancient road,the remains of a road used by ancient cultures,"Westernmost End (When feature is North to South Oriented, Southernmost End)",R - Transportation Networks
RDB,road bend,a conspicuously curved or bent section of a road,Center of Feature,R - Transportation Networks
RDCR,traffic circle,a road junction formed around a central circle about which traffic moves in one direction only,Center of Feature,S - Spot Features
RDCUT,road cut,an excavation cut through a hill or ridge for a road,Center of Feature,R - Transportation Networks
RDGB,beach ridge,"a ridge of sand just inland and parallel to the beach, usually in series",Center of Feature,T - Hypsographic
RDGE,ridge(s),"long narrow elevation(s) with steep sides, and a more or less continuous crest",Center of Feature,T - Hypsographic
RDGG,icecap ridge,a linear elevation on an icecap,Center of Feature,H - Hydrographic
RDGU,undersea ridge,a long narrow elevation with steep sides,Center of Feature (modification/addition requires ACUF approval),U - Undersea
RDIN,intersection,a junction of two or more highways by a system of separate levels that permit traffic to pass from one to another without the crossing of traffic streams,Center of Feature,R - Transportation Networks
RDJCT,road junction,a place where two or more roads join,Center of Feature,R - Transportation Networks
RDST,roadstead,an open anchorage affording less protection than a harbor,Center of Feature,H - Hydrographic
RDSU,undersea ridges,long narrow elevations with steep sides,Center of Feature (modification/addition requires ACUF approval),U - Undersea
RECG,golf course,a recreation field where golf is played,Center of Feature,S - Spot Features
RECR,racetrack,a track where races are held,Center of Feature,S - Spot Features
REG,stony desert,a desert plain characterized by a surface veneer of gravel and stones,Center of Feature,T - Hypsographic
RES,reserve,a tract of public land reserved for future use or restricted as to use,Center of Feature,L - Areas/Localities
RESA,agricultural reserve,a tract of land reserved for agricultural reclamation and/or development,Center of Feature,L - Areas/Localities
RESF,forest reserve,a forested area set aside for preservation or controlled use,Center of Feature,L - Areas/Localities
RESH,hunting reserve,a tract of land used primarily for hunting,Center of Feature,L - Areas/Localities
RESN,nature reserve,an area reserved for the maintenance of a natural habitat,Center of Feature,L - Areas/Localities
RESP,palm tree reserve,an area of palm trees where use is controlled,Center of Feature,L - Areas/Localities
RESV,reservation,"a tract of land set aside for aboriginal, tribal, or native populations",Center of Feature,L - Areas/Localities
RESW,wildlife reserve,a tract of public land reserved for the preservation of wildlife,Center of Feature,L - Areas/Localities
RET,store,a building where goods and/or services are offered for sale,Center of Feature,S - Spot Features
RF,reef(s),surface-navigation hazard(s) composed of consolidated material,Center of Feature,H - Hydrographic
RFC,coral reef(s),surface-navigation hazard(s) composed of coral,Center of Feature,H - Hydrographic
RFSU,undersea reefs,surface-navigation hazards composed of consolidated material,Center of Feature (modification/addition requires ACUF approval),U - Undersea
RFU,undersea reef,a surface-navigation hazard composed of consolidated material,Center of Feature (modification/addition requires ACUF approval),U - Undersea
RFX,section of reef,section of reef,Center of Feature,H - Hydrographic
RGN,region,an area distinguished by one or more observable physical characteristics,Center of Feature,L - Areas/Localities
RGNC,cultural region,"an area of cultural or historical significance, varying in size and often formerly an administrative subdivision or a political entity",Center of Feature,L - Areas/Localities
RGNE,economic region,a region of a country established for economic development or for statistical purposes,Center of Feature,L - Areas/Localities
RGNL,lake region,a tract of land distinguished by numerous lakes,Center of Feature,L - Areas/Localities
RHSE,resthouse,a structure maintained for the rest and shelter of travelers,Center of Feature,S - Spot Features
RISU,undersea rise,"a broad elevation that rises gently, and generally smoothly, from the sea floor",Center of Feature (modification/addition requires ACUF approval),U - Undersea
RJCT,railroad junction,a place where two or more railroad tracks join,Center of Feature,R - Transportation Networks
RK,rock,"a conspicuous, isolated rocky mass",Center of Feature,T - Hypsographic
RKFL,rockfall,an irregular mass of fallen rock at the base of a cliff or steep slope,Center of Feature,T - Hypsographic
RKRY,rookery,a breeding place of a colony of birds or seals,Center of Feature,S - Spot Features
RKS,rocks,"conspicuous, isolated rocky masses",Center of Feature,T - Hypsographic
RLG,religious site,an ancient site of significant religious importance,Center of Feature,S - Spot Features
RLGR,retreat,"a place of temporary seclusion, especially for religious groups",Center of Feature,S - Spot Features
RMPU,undersea ramp,a gentle slope connecting areas of different elevations,Center of Feature (modification/addition requires ACUF approval),U - Undersea
RNCH,ranch(es),large farm(s) specializing in extensive grazing of livestock,Center of Feature,S - Spot Features
RNGA,firing range,a tract of land designated for the safe discharge of weapons of all types and the detonation of munitions,Center of Feature,L - Areas/Localities
RNGU,undersea range,a series of associated ridges or seamounts,Center of Feature (modification/addition requires ACUF approval),U - Undersea
RPDS,rapids,"a turbulent section of a stream associated with a steep, irregular stream bed",Center of Feature,H - Hydrographic
RR,railroad,a permanent twin steel-rail track on which freight and passenger cars move long distances,"Westernmost End (When feature is North to South Oriented, Southernmost End)",R - Transportation Networks
RRQ,abandoned railroad,abandoned railroad,"Westernmost End (When feature is North to South Oriented, Southernmost End)",R - Transportation Networks
RSD,railroad siding,a short track parallel to and joining the main track,Center of Feature,S - Spot Features
RSGNL,railroad signal,a signal at the entrance of a particular section of track governing the movement of trains,Center of Feature,S - Spot Features
RSRT,resort,"a specialized facility for vacation, health, or participation sports activities",Center of Feature,S - Spot Features
RSTN,railroad station,"a facility comprising ticket office, platforms, etc. for loading and unloading train passengers and freight",Center of Feature,S - Spot Features
RSTNQ,abandoned railroad station,abandoned railroad station,Center of Feature,S - Spot Features
RSTP,railroad stop,a place lacking station facilities where trains stop to pick up and unload passengers and freight,Center of Feature,S - Spot Features
RSTPQ,abandoned railroad stop,abandoned railroad stop,Center of Feature,S - Spot Features
RSV,reservoir(s),artificial pond(s) or lake(s),Center of Feature,H - Hydrographic
RSVI,intermittent reservoir,intermittent reservoir,Center of Feature,H - Hydrographic
RSVT,water tank,"a contained pool or tank of water at, below, or above ground level",Center of Feature,H - Hydrographic
RTE,caravan route,the route taken by caravans,"Westernmost End (When feature is North to South Oriented, Southernmost End)",R - Transportation Networks
RUIN,ruin(s),destroyed or decayed structure(s) which is/are no longer functional,Center of Feature,S - Spot Features
RVN,ravine(s),"small, narrow, deep, steep-sided stream channel(s), smaller than a gorge",Center of Feature,H - Hydrographic
RYD,railroad yard,"a system of tracks used for the making up of trains, and switching and storing freight cars",Center of Feature,R - Transportation Networks
RYDQ,abandoned railroad yard,an abandoned railroad yard,Center of Feature,S - Spot Features
SALT,salt area,a shallow basin or flat where salt accumulates after periodic inundation,Center of Feature,L - Areas/Localities
SAND,sand area,a tract of land covered with sand,Center of Feature,T - Hypsographic
SBED,dry stream bed,a channel formerly containing the water of a stream,Center of Feature,T - Hypsographic
SBKH,sabkha(s),salt flat(s) or salt encrusted plain(s) subject to periodic inundation from flooding or high tides,Center of Feature,H - Hydrographic
SCH,school,building(s) where instruction in one or more branches of knowledge takes place,Center of Feature,S - Spot Features
SCHA,agricultural school,a school with a curriculum focused on agriculture,Center of Feature,S - Spot Features
SCHC,college,the grounds and buildings of an institution of higher learning,Center of Feature,S - Spot Features
SCHM,military school,a school at which military science forms the core of the curriculum,Center of Feature,S - Spot Features
SCHN,maritime school,a school at which maritime sciences form the core of the curriculum,Center of Feature,S - Spot Features
SCHT,technical school,post-secondary school with a specifically technical or vocational curriculum,Center of Feature,S - Spot Features
SCNU,seachannel,"a continuously sloping, elongated depression commonly found in fans or plains and customarily bordered by levees on one or two sides",Center of Feature (modification/addition requires ACUF approval),U - Undersea
SCRB,scrubland,"a tract covered sparsely by low trees, bushes, and/or shrubs that have been stunted by an environmental limitation",Center of Feature,V - Vegetation
SCRP,escarpment,a long line of cliffs or steep slopes separating level surfaces above and below,Center of Feature,T - Hypsographic
SCSU,seachannels,"continuously sloping, elongated depressions commonly found in fans or plains and customarily bordered by levees on one or two sides",Center of Feature (modification/addition requires ACUF approval),U - Undersea
SD,sound,a long arm of the sea forming a channel between the mainland and an island or islands; or connecting two larger bodies of water,Center of Feature,H - Hydrographic
SDL,saddle,"a broad, open pass crossing a ridge or between hills or mountains",Center of Feature,T - Hypsographic
SDLU,undersea saddle,"a low part, resembling in shape a saddle, in a ridge or between contiguous seamounts",Center of Feature (modification/addition requires ACUF approval),U - Undersea
SEA,sea,a large body of salt water more or less confined by continuous land or chains of islands forming a subdivision of an ocean,Center of Feature (changes to primary name or designation require BGN/FNC approval),H - Hydrographic
SHFU,undersea shelf,a zone adjacent to a continent (or around an island) that extends from the low water line to a depth at which there is usually a marked increase of slope towards oceanic depths,Center of Feature (modification/addition requires ACUF approval),U - Undersea
SHLU,undersea shoal,a surface-navigation hazard composed of unconsolidated material,Center of Feature (modification/addition requires ACUF approval),U - Undersea
SHOL,shoal(s),surface-navigation hazard(s) composed of unconsolidated material,Center of Feature,H - Hydrographic
SHOPC,shopping center or mall,an urban shopping area featuring a variety of shops surrounding a usually open-air concourse reserved for pedestrian traffic; or a large suburban building or group of buildings containing various shops with associated passageways,Center of Feature,S - Spot Features
SHOR,shore,"a narrow zone bordering a waterbody which covers and uncovers at high and low water, respectively",Center of Feature,T - Hypsographic
SHRN,shrine,a structure or place memorializing a person or religious concept,Center of Feature,S - Spot Features
SHSE,storehouse,"a building for storing goods, especially provisions",Center of Feature,S - Spot Features
SHSU,undersea shoals,hazards to surface navigation composed of unconsolidated material,Center of Feature (modification/addition requires ACUF approval),U - Undersea
SHVU,undersea shelf valley,"a valley on the shelf, generally the shoreward extension of a canyon",Center of Feature (modification/addition requires ACUF approval),U - Undersea
SILU,undersea sill,"the low part of an underwater gap or saddle separating basins, including a similar feature at the mouth of a fjord",Center of Feature (modification/addition requires ACUF approval),U - Undersea
SINK,sinkhole,a small crater-shape depression in a karst area,Center of Feature,T - Hypsographic
SLCE,sluice,"a conduit or passage for carrying off surplus water from a waterbody, usually regulated by means of a sluice gate",Center of Feature,S - Spot Features
SLID,slide,"a mound of earth material, at the base of a slope and the associated scoured area",Center of Feature,T - Hypsographic
SLP,slope(s),surface(s) with a relatively uniform slope angle,Center of Feature,T - Hypsographic
SLPU,undersea slope,the slope seaward from the shelf edge to the beginning of a continental rise or the point where there is a general reduction in slope,Center of Feature (modification/addition requires ACUF approval),U - Undersea
SMSU,seamounts,"elevations rising generally more than 1,000 meters and of limited extent across the summit",Center of Feature (modification/addition requires ACUF approval),U - Undersea
SMU,seamount,"an elevation rising generally more than 1,000 meters and of limited extent across the summit",Center of Feature (modification/addition requires ACUF approval),U - Undersea
SNOW,snowfield,an area of permanent snow and ice forming the accumulation area of a glacier,Center of Feature,L - Areas/Localities
SNTR,sanatorium,a facility where victims of physical or mental disorders are treated,Center of Feature,S - Spot Features
SPA,spa,a resort area usually developed around a medicinal spring,Center of Feature,S - Spot Features
SPIT,spit,"a narrow, straight or curved continuation of a beach into a waterbody",Center of Feature,T - Hypsographic
SPLY,spillway,"a passage or outlet through which surplus water flows over, around or through a dam",Center of Feature,S - Spot Features
SPNG,spring(s),place(s) where ground water flows naturally out of the ground,Center of Feature,H - Hydrographic
SPNS,sulphur spring(s),place(s) where sulphur ground water flows naturally out of the ground,Center of Feature,H - Hydrographic
SPNT,hot spring(s),place(s) where hot ground water flows naturally out of the ground,Center of Feature,H - Hydrographic
SPRU,undersea spur,"a subordinate elevation, ridge, or rise projecting outward from a larger feature",Center of Feature (modification/addition requires ACUF approval),U - Undersea
SPUR,spur(s),"subordinate ridge(s) projecting outward from a hill, mountain or other elevation",Center of Feature,T - Hypsographic
SQR,square,"a broad, open, public area near the center of a town or city",Center of Feature,S - Spot Features
ST,street,a paved urban thoroughfare,"Westernmost End (When feature is North to South Oriented, Southernmost End)",R - Transportation Networks
STBL,stable,"a building for the shelter and feeding of farm animals, especially horses",Center of Feature,S - Spot Features
STDM,stadium,a structure with an enclosure for athletic games with tiers of seats for spectators,Center of Feature,S - Spot Features
STKR,stock route,a route taken by livestock herds,"Westernmost End (When feature is North to South Oriented, Southernmost End)",R - Transportation Networks
STLMT,Israeli settlement,Israeli settlement,Center of Feature,P - Populated Places
STM,stream(s),natural flowing watercourse(s),At Mouth,H - Hydrographic
STMA,anabranch,a diverging branch flowing out of a main stream and rejoining it downstream,At Mouth,H - Hydrographic
STMB,stream bend,a conspicuously curved or bent segment of a stream,Center of Feature,H - Hydrographic
STMC,canalized stream,"a stream that has been substantially ditched, diked, or straightened",At Mouth,H - Hydrographic
STMD,distributary(-ies),"branch(es) which flow(s) away from the main stream, as in a delta or irrigation canal(s)",At Mouth,H - Hydrographic
STMGS,stream gauging station,"named place where a measuring station for a watercourse, reservoir or other water body exists",Center of Feature,S - Spot Features
STMH,headwaters,"the source and upper part of a stream, including the upper drainage basin",Center of Feature,H - Hydrographic
STMI,intermittent stream,intermittent stream,At Mouth,H - Hydrographic
STMIX,section of intermittent stream,section of intermittent stream,Center of Feature,H - Hydrographic
STMM,stream mouth(s),"place(s) where a stream discharges into a lagoon, lake, or the sea",Center of Feature,H - Hydrographic
STMQ,abandoned watercourse,"a former stream or distributary no longer carrying flowing water, but still evident due to lakes, wetland, topographic or vegetation patterns","Westernmost End (When feature is North to South Oriented, Southernmost End)",H - Hydrographic
STMSB,lost river,"a surface stream that disappears into an underground channel, or dries up in an arid area",Where stream disperses in arid area or goes underground,H - Hydrographic
STMX,section of stream,section of stream,Center of Feature,H - Hydrographic
STNB,scientific research base,a facility for carrying out scientific/technological research or experiments,Center of Feature,S - Spot Features
STNC,coast guard station,a facility from which the coast is guarded by armed vessels,Center of Feature,S - Spot Features
STNF,forest station,a collection of buildings and facilities for carrying out forest management,Center of Feature,S - Spot Features
STNI,inspection station,"a station at which vehicles, goods, and people are inspected",Center of Feature,S - Spot Features
STNM,meteorological station,a station at which weather elements are recorded,Center of Feature,S - Spot Features
STNR,radio station,a facility for producing and transmitting information by radio waves,Center of Feature,S - Spot Features
STNS,satellite station,a facility for tracking and communicating with orbiting satellites,Center of Feature,S - Spot Features
STNW,whaling station,a facility for butchering whales and processing train oil,Center of Feature,S - Spot Features
STPS,steps,stones or slabs placed for ease in ascending or descending a steep slope,Center of Feature,S - Spot Features
STRT,strait,"a relatively narrow waterway, usually narrower and less extensive than a sound, connecting two larger bodies of water",Center of Feature,H - Hydrographic
SUBS,subway station,"a facility comprising ticket office, platforms, etc. for loading and unloading subway passengers",Center of Feature,S - Spot Features
SUBW,subway,"a railroad used for mass public transportation primarily in urban areas, all or part of the system may be located below, above, or at ground level",Center of Feature,S - Spot Features
SWMP,swamp,a wetland dominated by tree vegetation,Center of Feature,H - Hydrographic
SWT,sewage treatment plant,facility for the processing of sewage and/or wastewater,Center of Feature,S - Spot Features
SYG,synagogue,a place for Jewish worship and religious instruction,Center of Feature,S - Spot Features
SYSI,irrigation system,"a network of ditches and one or more of the following elements:  water supply, reservoir, canal, pump, well, drain, etc.",Center of Feature,H - Hydrographic
TAL,talus slope,a steep concave slope formed by an accumulation of loose rock fragments at the base of a cliff or steep slope,Center of Feature,T - Hypsographic
TERR,territory,territory,Center of Feature,A - Administrative Regions
TERU,undersea terrace,"a relatively flat horizontal or gently inclined surface, sometimes long and narrow, which is bounded by a steeper ascending slope on one side and by a steep descending slope on the opposite side",Center of Feature (modification/addition requires ACUF approval),U - Undersea
THTR,theater,"a building or outdoor area used for live theatrical presentations, concerts, opera or dance productions, cinema, and/or other stage productions",Center of Feature,S - Spot Features
TMB,tomb(s),structure(s) for interring bodies,Center of Feature,S - Spot Features
TMPL,temple(s),edifice(s) dedicated to religious worship,Center of Feature,S - Spot Features
TMSU,tablemounts (or guyots),"seamounts having a comparatively smooth, flat top",Center of Feature (modification/addition requires ACUF approval),U - Undersea
TMTU,tablemount (or guyot),"a seamount having a comparatively smooth, flat top",Center of Feature (modification/addition requires ACUF approval),U - Undersea
